{
  "schema": 1,
  "robot_id": "arm_left",
  "state": "idle",
  "task_id": null,
  "task": null,
  "since": 1760356803410,
  "paused": false,
  "inhibited": false,
  "ha_link": "up",
  "watchdog_mode": "none",
  "executor_health": {
    "level": "ok",
    "message": ""
  },
  "error": null,
  "session": "9f1c7a0e-4a1b-4b2c-8d1e-0f1a2b3c4d5e",
  "instance": "robotpc:4123",
  "seq": 43,
  "ts": 1760356803412
}
