{
  "schema": 1,
  "robot_id": "arm_left",
  "state": "busy",
  "task_id": "7b3e9d21-5f6a-4c8b-9e0d-1f2a3b4c5d6e",
  "task": "wait",
  "since": 1760356801000,
  "paused": true,
  "inhibited": false,
  "ha_link": "up",
  "watchdog_mode": "none",
  "executor_health": {
    "level": "ok",
    "message": ""
  },
  "error": null,
  "session": "9f1c7a0e-4a1b-4b2c-8d1e-0f1a2b3c4d5e",
  "instance": "robotpc:4123",
  "seq": 45,
  "ts": 1760356805000
}
